<?xml version="1.0"?>
<!DOCTYPE issues [
<!ELEMENT issues (issue*)>
<!ATTLIST issues burpVersion CDATA "">
<!ATTLIST issues exportTime CDATA "">
<!ELEMENT issue (serialNumber, type, name, host, path, location, severity, confidence, issueBackground?, remediationBackground?, references?, vulnerabilityClassifications?, issueDetail?, issueDetailItems?, remediationDetail?, requestresponse*, collaboratorEvent*, infiltratorEvent*, staticAnalysis*, dynamicAnalysis*, prototypePollution*)>
<!ELEMENT serialNumber (#PCDATA)>
<!ELEMENT type (#PCDATA)>
<!ELEMENT name (#PCDATA)>
<!ELEMENT host (#PCDATA)>
<!ATTLIST host ip CDATA "">
<!ELEMENT path (#PCDATA)>
<!ELEMENT location (#PCDATA)>
<!ELEMENT severity (#PCDATA)>
<!ELEMENT confidence (#PCDATA)>
<!ELEMENT issueBackground (#PCDATA)>
<!ELEMENT remediationBackground (#PCDATA)>
<!ELEMENT references (#PCDATA)>
<!ELEMENT vulnerabilityClassifications (#PCDATA)>
<!ELEMENT issueDetail (#PCDATA)>
<!ELEMENT issueDetailItems (issueDetailItem*)>
<!ELEMENT issueDetailItem (#PCDATA)>
<!ELEMENT remediationDetail (#PCDATA)>
<!ELEMENT requestresponse (request?, response?, responseRedirected?)>
<!ELEMENT request (#PCDATA)>
<!ATTLIST request method CDATA "">
<!ATTLIST request base64 (true|false) "false">
<!ELEMENT response (#PCDATA)>
<!ATTLIST response base64 (true|false) "false">
<!ELEMENT responseRedirected (#PCDATA)>
<!ELEMENT sender (#PCDATA)>
<!ELEMENT message (#PCDATA)>
<!ELEMENT conversation (#PCDATA)>
<!ELEMENT recipient (#PCDATA)>
<!ELEMENT recipients (recipient*)>
<!ELEMENT smtp (sender, recipients, message, conversation)>
<!ELEMENT collaboratorEvent (interactionType, originIp, time, lookupType?, lookupHost?, requestresponse?, smtp?)>
<!ELEMENT interactionType (#PCDATA)>
<!ELEMENT originIp (#PCDATA)>
<!ELEMENT time (#PCDATA)>
<!ELEMENT lookupType (#PCDATA)>
<!ELEMENT lookupHost (#PCDATA)>
<!ELEMENT infiltratorEvent (parameterName, platform, signature, stackTrace?, parameterValue?, collaboratorEvent)>
<!ELEMENT parameterName (#PCDATA)>
<!ELEMENT platform (#PCDATA)>
<!ELEMENT signature (#PCDATA)>
<!ELEMENT stackTrace (#PCDATA)>
<!ELEMENT parameterValue (#PCDATA)>
<!ELEMENT dynamicAnalysis (source, sink, sourceStackTrace, sinkStackTrace, eventListenerStackTrace, sourceValue, sinkValue, eventHandlerData, eventHandlerDataType, eventHandlerManipulatedData, poc, origin, isOriginChecked, sourceElementId, sourceElementName, eventFiredEventName, eventFiredElementId, eventFiredElementName, eventFiredOuterHtml)>
<!ELEMENT prototypePollution (poc, pollutionTechnique, pollutionType)>
<!ELEMENT staticAnalysis (source, sink, codeSnippets)>
<!ELEMENT source (#PCDATA)>
<!ELEMENT sink (#PCDATA)>
<!ELEMENT sourceStackTrace (#PCDATA)>
<!ELEMENT sinkStackTrace (#PCDATA)>
<!ELEMENT eventListenerStackTrace (#PCDATA)>
<!ELEMENT sourceValue (#PCDATA)>
<!ELEMENT sinkValue (#PCDATA)>
<!ELEMENT eventHandlerData (#PCDATA)>
<!ELEMENT eventHandlerDataType (#PCDATA)>
<!ELEMENT sourceElementId (#PCDATA)>
<!ELEMENT sourceElementName (#PCDATA)>
<!ELEMENT eventFiredEventName (#PCDATA)>
<!ELEMENT eventFiredElementId (#PCDATA)>
<!ELEMENT eventFiredElementName (#PCDATA)>
<!ELEMENT eventFiredOuterHtml (#PCDATA)>
<!ELEMENT eventHandlerManipulatedData (#PCDATA)>
<!ELEMENT poc (#PCDATA)>
<!ELEMENT origin (#PCDATA)>
<!ELEMENT isOriginChecked (#PCDATA)>
<!ELEMENT codeSnippets (codeSnippet*)>
<!ELEMENT codeSnippet (#PCDATA)>
<!ELEMENT pollutionTechnique (#PCDATA)>
<!ELEMENT pollutionType (#PCDATA)>
]>
<issues burpVersion="2023.8.1" exportTime="Mon Aug 14 19:30:36 GMT 2023">
  <issue>
    <serialNumber>2881379759837008896</serialNumber>
    <type>134217728</type>
    <name><![CDATA[Session token in URL]]></name>
    <host ip="172.20.0.3">http://web</host>
    <path><![CDATA[/wp-admin/admin-ajax.php]]></path>
    <location><![CDATA[/wp-admin/admin-ajax.php]]></location>
    <severity>Medium</severity>
    <confidence>Firm</confidence>
    <issueBackground><![CDATA[<p>Sensitive information within URLs may be logged in various locations, including the user's browser, the web server, and any forward or reverse proxy servers between the two endpoints. URLs may also be displayed on-screen, bookmarked or emailed around by users. They may be disclosed to third parties via the Referer header when any off-site links are followed. Placing session tokens into the URL increases the risk that they will be captured by an attacker.</p>]]></issueBackground>
    <remediationBackground><![CDATA[<p>Applications should use an alternative mechanism for transmitting session tokens, such as HTTP cookies or hidden fields in forms that are submitted using the POST method.</p>]]></remediationBackground>
    <issueDetail><![CDATA[The URL in the request appears to contain a session token within the query string:<ul><li>http://web/wp-admin/admin-ajax.php?tracksNonce=fuzz&amp;tracksEventName=fuzz&amp;tracksEventProp=fuzz&amp;action=platform_tracks</li></ul>]]></issueDetail>
    <issueDetailItems>
      <issueDetailItem><![CDATA[http://web/wp-admin/admin-ajax.php?tracksNonce=fuzz&tracksEventName=fuzz&tracksEventProp=fuzz&action=platform_tracks]]></issueDetailItem>
    </issueDetailItems>
    <requestresponse>
      <request method="GET" base64="true"><![CDATA[R0VUIC93cC1hZG1pbi9hZG1pbi1hamF4LnBocD90cmFja3NOb25jZT1mdXp6JnRyYWNrc0V2ZW50TmFtZT1mdXp6JnRyYWNrc0V2ZW50UHJvcD1mdXp6JmFjdGlvbj1wbGF0Zm9ybV90cmFja3MgSFRUUC8xLjANCkhvc3Q6IHdlYg0KDQo=]]></request>
      <response base64="true"><![CDATA[SFRUUC8xLjEgNDAwIEJhZCBSZXF1ZXN0DQpEYXRlOiBNb24sIDE0IEF1ZyAyMDIzIDE5OjI3OjM0IEdNVA0KU2VydmVyOiBBcGFjaGUvMi40LjU2IChEZWJpYW4pDQpDb250ZW50LUxlbmd0aDogMzAyDQpDb25uZWN0aW9uOiBjbG9zZQ0KQ29udGVudC1UeXBlOiB0ZXh0L2h0bWw7IGNoYXJzZXQ9aXNvLTg4NTktMQ0KDQo8IURPQ1RZUEUgSFRNTCBQVUJMSUMgIi0vL0lFVEYvL0RURCBIVE1MIDIuMC8vRU4iPgo8aHRtbD48aGVhZD4KPHRpdGxlPjQwMCBCYWQgUmVxdWVzdDwvdGl0bGU+CjwvaGVhZD48Ym9keT4KPGgxPkJhZCBSZXF1ZXN0PC9oMT4KPHA+WW91ciBicm93c2VyIHNlbnQgYSByZXF1ZXN0IHRoYXQgdGhpcyBzZXJ2ZXIgY291bGQgbm90IHVuZGVyc3RhbmQuPGJyIC8+CjwvcD4KPGhyPgo8YWRkcmVzcz5BcGFjaGUvMi40LjU2IChEZWJpYW4pIFNlcnZlciBhdCAxNzIuMjAuMC4zIFBvcnQgODA8L2FkZHJlc3M+CjwvYm9keT48L2h0bWw+Cg==]]></response>
      <responseRedirected>false</responseRedirected>
    </requestresponse>
  </issue>
  <issue>
    <serialNumber>4622732110994696192</serialNumber>
    <type>134217728</type>
    <name><![CDATA[Private IP addresses disclosed]]></name>
    <host ip="172.20.0.3">http://web</host>
    <path><![CDATA[/wp-admin/admin-ajax.php]]></path>
    <location><![CDATA[/wp-admin/admin-ajax.php]]></location>
    <severity>Information</severity>
    <confidence>Certain</confidence>
    <issueBackground><![CDATA[<p>RFC 1918 specifies ranges of IP addresses that are reserved for use in private networks and cannot be routed on the public Internet. Although various methods exist by which an attacker can determine the public IP addresses in use by an organization, the private addresses used internally cannot usually be determined in the same ways.</p>
<p>Discovering the private addresses used within an organization can help an attacker in carrying out network-layer attacks aiming to penetrate the organization's internal infrastructure. </p>]]></issueBackground>
    <remediationBackground><![CDATA[<p>There is not usually any good reason to disclose the internal IP addresses used within an organization's infrastructure. If these are being returned in service banners or debug messages, then the relevant services should be configured to mask the private addresses. If they are being used to track back-end servers for load balancing purposes, then the addresses should be rewritten with innocuous identifiers from which an attacker cannot infer any useful information about the infrastructure.</p>]]></remediationBackground>
    <issueDetail><![CDATA[The following RFC 1918 IP address was disclosed in the response:<ul><li>172.20.0.3</li></ul>]]></issueDetail>
    <issueDetailItems>
      <issueDetailItem><![CDATA[172.20.0.3]]></issueDetailItem>
    </issueDetailItems>
    <requestresponse>
      <request method="GET" base64="true"><![CDATA[R0VUIC93cC1hZG1pbi9hZG1pbi1hamF4LnBocD90cmFja3NOb25jZT1mdXp6JnRyYWNrc0V2ZW50TmFtZT1mdXp6JnRyYWNrc0V2ZW50UHJvcD1mdXp6JmFjdGlvbj1wbGF0Zm9ybV90cmFja3MgSFRUUC8xLjANCkhvc3Q6IHdlYg0KDQo=]]></request>
      <response base64="true"><![CDATA[SFRUUC8xLjEgNDAwIEJhZCBSZXF1ZXN0DQpEYXRlOiBNb24sIDE0IEF1ZyAyMDIzIDE5OjI3OjM0IEdNVA0KU2VydmVyOiBBcGFjaGUvMi40LjU2IChEZWJpYW4pDQpDb250ZW50LUxlbmd0aDogMzAyDQpDb25uZWN0aW9uOiBjbG9zZQ0KQ29udGVudC1UeXBlOiB0ZXh0L2h0bWw7IGNoYXJzZXQ9aXNvLTg4NTktMQ0KDQo8IURPQ1RZUEUgSFRNTCBQVUJMSUMgIi0vL0lFVEYvL0RURCBIVE1MIDIuMC8vRU4iPgo8aHRtbD48aGVhZD4KPHRpdGxlPjQwMCBCYWQgUmVxdWVzdDwvdGl0bGU+CjwvaGVhZD48Ym9keT4KPGgxPkJhZCBSZXF1ZXN0PC9oMT4KPHA+WW91ciBicm93c2VyIHNlbnQgYSByZXF1ZXN0IHRoYXQgdGhpcyBzZXJ2ZXIgY291bGQgbm90IHVuZGVyc3RhbmQuPGJyIC8+CjwvcD4KPGhyPgo8YWRkcmVzcz5BcGFjaGUvMi40LjU2IChEZWJpYW4pIFNlcnZlciBhdCAxNzIuMjAuMC4zIFBvcnQgODA8L2FkZHJlc3M+CjwvYm9keT48L2h0bWw+Cg==]]></response>
      <responseRedirected>false</responseRedirected>
    </requestresponse>
  </issue>
</issues>
